{
  "version": "2.9.14",
  "policy_kind": "runtime_model_governance_policy",
  "description": "Domain-neutral model governance policy for stage-bound model selection, multimodal capabilities, validation, cost control, on-demand installation, fallback, escalation, and recommendation intake.",
  "governance_principles": [
    "Runtime stages choose models through policy, not through ad-hoc prompt decisions.",
    "Deterministic taxonomy, registry, parser, and validator components are preferred before LLM proposals.",
    "LLMs may propose candidates; runtime policy, schema validation, benchmarks, and operator preferences decide acceptance.",
    "Weak or low-tier models must not directly consume complex raw evidence for final synthesis.",
    "Every stage must declare validation, fallback, escalation, downgrade, cost, and privacy behavior.",
    "Business or domain-specific keywords are forbidden in this policy. Capabilities are generic and modality-based."
  ],
  "global_policy": {
    "cost_policy": {
      "allow_paid_models": true,
      "prefer_local_when_quality_sufficient": true,
      "prefer_lower_cost_for_low_risk_stages": true,
      "missing_paid_key_action": "skip_and_try_lower_substitute",
      "user_requested_free_mode_action": "use_lower_substitutes_then_local_fallback",
      "max_paid_retry_per_stage": 1
    },
    "quality_policy": {
      "minimum_schema_success_rate": 0.92,
      "minimum_json_stability_score": 0.9,
      "minimum_stage_quality_score": 0.75,
      "prefer_benchmark_scores_over_static_capability_tags": true,
      "unknown_model_default_status": "candidate_only"
    },
    "privacy_policy": {
      "default_data_boundary": "runtime_decides_by_stage",
      "local_first_for_sensitive_material": true,
      "external_model_requires_stage_allow_external": true,
      "redact_secrets_before_external_call": true,
      "raw_evidence_external_call_requires_reduction": true
    },
    "missing_model_policy": {
      "local_model_action": "download_on_demand",
      "external_model_action": "use_when_key_available",
      "unknown_model_action": "register_as_candidate_then_validate",
      "unknown_stage_action": "use_general_runtime_then_request_policy_proposal",
      "download_requires_catalog_entry": true
    },
    "runtime_learning_policy": {
      "record_latency": true,
      "record_schema_failures": true,
      "record_user_feedback": true,
      "record_cost_estimate": true,
      "adjust_candidate_priority_from_runtime_scores": true,
      "never_overwrite_seed_policy_without_review": true
    },
    "routing_control": {
      "model_routing_is_deterministic": true,
      "llm_may_only_propose_candidates": true,
      "capability_routing_uses_taxonomy_first": true,
      "execution_mode_uses_policy_first": true,
      "tool_selection_uses_registry_first": true,
      "final_model_selection_uses_policy_resolver": true
    },
    "recommendation_intake_policy": {
      "strong_model_may_recommend_new_models": true,
      "recommendation_output_schema_required": true,
      "recommended_model_status": "candidate_only",
      "candidate_acceptance_requires": [
        "catalog_normalization",
        "provider_template_resolution",
        "capability_benchmark",
        "schema_stability_test",
        "cost_profile_check",
        "runtime_operator_review_or_policy_auto_accept"
      ]
    },
    "runtime_switch": {
      "local_models_enabled": false,
      "deprecated": true,
      "replaced_by": "global_policy.runtime_execution_policy.local_enabled",
      "switch_sources": [
        "global_policy.runtime_execution_policy.local_enabled",
        "AI_CORE_LOCAL_MODELS_ENABLED"
      ]
    },
    "local_model_policy": {
      "enabled": true,
      "default_provider_order": [
        "ollama"
      ],
      "code_provider_order": [
        "ollama_coder_qwen25",
        "ollama_coder_deepseek"
      ],
      "api_provider_order": [
        "openai",
        "claude"
      ],
      "api_only_when_disabled": false,
      "local_unavailable_action": "try_next_local_then_api_fallback",
      "default_local_runtime": "ollama",
      "fallback_local_runtime": "ollama",
      "selection_rule": "policy_resolver_expands_one_model_catalog_entry_into_runtime_ordered_provider_templates",
      "deprecated_authority": true,
      "replaced_by": "global_policy.runtime_execution_policy"
    },
    "runtime_execution_policy": {
      "source_of_truth": true,
      "default_mode": "local_only",
      "local_enabled": true,
      "api_only_when_local_disabled": false,
      "api_provider_order": [
        "openai",
        "claude"
      ],
      "local_provider_order": [
        "ollama"
      ],
      "local_code_provider_order": [
        "ollama_coder_qwen25",
        "ollama_coder_deepseek"
      ],
      "credential_recovery_enabled": true,
      "credential_storage": "runtime/configs/secrets/secrets.json",
      "environment_override": "AI_CORE_LOCAL_MODELS_ENABLED",
      "runtime_cost_policy": {
        "enabled": true,
        "max_prompt_tokens": 6000,
        "max_provider_attempts": 2,
        "max_external_discovery_attempts": 1,
        "max_generated_component_attempts": 1,
        "max_evidence_pages": 5,
        "max_evidence_page_chars": 18000,
        "operation_timeout_seconds": 900,
        "sandbox_timeout_seconds": 60,
        "prefer_repair_before_model_escalation": true,
        "allow_paid_model_escalation": true,
        "notes": "Domain-neutral runtime budget and convergence controls.",
        "stage_timeouts": {
          "web_discovery": 30,
          "web_search": 90,
          "extraction": 45,
          "evidence_validation": 20,
          "api_discovery": 15,
          "api_call": 30,
          "synthesis": 20,
          "input_parsing": 120,
          "intent_recognition": 120,
          "context_awareness": 30,
          "workflow_planning": 240,
          "execution": 300,
          "feedback_learning": 90,
          "output": 120,
          "semantic_task_graph_planning": 90
        },
        "method_timeout_seconds": {
          "api_call": 30,
          "web_search": 90,
          "extraction": 45
        },
        "adaptive_evidence": {
          "enabled": true,
          "min_sources": 2,
          "max_sources": 5,
          "candidate_window": 6,
          "initial_fetches": 2,
          "incremental_fetches": 1,
          "max_fetches": 5,
          "fetch_chars_per_source": 18000,
          "llm_material_chars": 6000,
          "fact_limit": 48,
          "block_limit": 32,
          "stop_quality_score": 0.78
        }
      }
    }
  },
  "capability_taxonomy": {
    "modalities": [
      "text",
      "audio",
      "image",
      "video",
      "file",
      "code",
      "structured_data",
      "multimodal"
    ],
    "capability_groups": {
      "language_core": [
        "language_detection",
        "input_parsing",
        "structured_extraction",
        "json_generation",
        "reasoning",
        "planning",
        "translation",
        "summarization"
      ],
      "governance": [
        "capability_classification",
        "execution_mode_decision",
        "model_routing",
        "schema_validation",
        "schema_repair",
        "fact_verification",
        "risk_assessment"
      ],
      "retrieval_evidence": [
        "embedding_generation",
        "query_rewrite",
        "reranking",
        "evidence_extraction",
        "evidence_compression",
        "citation_grounding"
      ],
      "tooling_code": [
        "tool_selection",
        "tool_generation",
        "code_generation",
        "code_review",
        "test_generation",
        "debugging",
        "schema_design"
      ],
      "artifact_generation": [
        "document_generation",
        "spreadsheet_generation",
        "slide_generation",
        "pdf_generation",
        "diagram_generation",
        "file_transformation",
        "report_generation",
        "plan_generation"
      ],
      "audio": [
        "speech_to_text",
        "text_to_speech",
        "audio_understanding",
        "audio_generation",
        "voice_conversion"
      ],
      "vision_image": [
        "image_understanding",
        "image_generation",
        "image_editing",
        "ocr",
        "layout_understanding",
        "chart_understanding"
      ],
      "video": [
        "video_understanding",
        "video_generation",
        "video_editing",
        "frame_analysis"
      ]
    }
  },
  "model_catalog": {
    "deterministic_taxonomy": {
      "provider_template": "internal",
      "provider_model": "deterministic_taxonomy",
      "family": "runtime_policy",
      "vendor": "internal",
      "tier": "deterministic",
      "cost_class": "free",
      "deployment": "local_runtime",
      "install_strategy": "built_in",
      "status": "available",
      "modalities": {
        "input": [
          "structured_data"
        ],
        "output": [
          "structured_data"
        ]
      },
      "capabilities": [
        "capability_classification",
        "schema_validation"
      ],
      "priority_bias": 100
    },
    "deterministic_runtime_policy": {
      "provider_template": "internal",
      "provider_model": "deterministic_runtime_policy",
      "family": "runtime_policy",
      "vendor": "internal",
      "tier": "deterministic",
      "cost_class": "free",
      "deployment": "local_runtime",
      "install_strategy": "built_in",
      "status": "available",
      "modalities": {
        "input": [
          "structured_data"
        ],
        "output": [
          "structured_data"
        ]
      },
      "capabilities": [
        "model_routing",
        "execution_mode_decision",
        "schema_validation"
      ],
      "priority_bias": 100
    },
    "deterministic_registry": {
      "provider_template": "internal",
      "provider_model": "deterministic_registry",
      "family": "runtime_policy",